#Misc Stuff;;;;;;;;;;;;;;x
is_sinosphere_small_trigger_desc;Is Portuguese or Portunhol Culture;Est une culture sinique ou sinis?e;;;;;;;;;;;;x
is_sinosphere_large_trigger_desc;Is Portuguese or Portunhol Culture, or close to Brazilia;Est une culture sinique ou sinis?e, ou proche de la Chine;;;;;;;;;;;;x
is_baklava_culture_desc;Is a culture that produces and consumes delicious Baklava;Est une culture qui produit et consomme de d?licieux Baklava;;;;;;;;;;;;x
is_hummus_culture_desc;Is a culture that produces and consumes delicious Hummus;Est une culture qui produit et consomme de d?licieux houmous;;;;;;;;;;;;x
VIET_DEATH_BY_SCORPION;died when stung by a Scorpion;mort d'une piqure de scorpion;;;;;;;;;;;;x
VIET_DEATH_CHOKING_FOOD;died choking on food;mort ?touff? par la nourriture;;;;;;;;;;;;x
VIET_DEATH_FOUND_IN_BED;was found mysteriously dead in bed;a ?t? retrouv? myst?rieusement mort dans son lit;;;;;;;;;;;;x
xxxxxxxxxxxxxxxxxxxxx;Baklava;Baklava;;;;;;;;;;;;x
